[
  {"season":"2026/27","competition":"Liga Portugal","round":1,"date":"2026-08-08","home_team":"Estrela da Amadora","away_team":"Sporting CP","score":"2-2","referee":"João Gonçalves","var":"Tiago Martins","tracked_club":"Sporting CP","review_status":"reviewed","match_key":"R1-Estrela_da_Amadora-Sporting_CP"},
  {"season":"2026/27","competition":"Liga Portugal","round":1,"date":"2026-08-09","home_team":"FC Porto","away_team":"FC Alverca","score":"2-0","referee":"Luís Godinho","var":"Bruno Esteves","tracked_club":"FC Porto","review_status":"reviewed","match_key":"R1-FC_Porto-FC_Alverca"},
  {"season":"2026/27","competition":"Liga Portugal","round":1,"date":"2026-08-09","home_team":"SL Benfica","away_team":"Académico de Viseu","score":"2-2","referee":"David Silva","var":null,"tracked_club":"SL Benfica","review_status":"reviewed","match_key":"R1-SL_Benfica-Académico_de_Viseu"},
  {"season":"2026/27","competition":"Liga Portugal","round":2,"date":"2026-08-14","home_team":"Sporting CP","away_team":"Vitória SC","score":"3-2","referee":"David Rafael Silva","var":"Manuel Oliveira","tracked_club":"Sporting CP","review_status":"reviewed","match_key":"R2-Sporting_CP-Vitória_SC"},
  {"season":"2026/27","competition":"Liga Portugal","round":2,"date":"2026-08-15","home_team":"Rio Ave","away_team":"FC Porto","score":"0-2","referee":"Miguel Fonseca","var":"Cláudia Ribeiro","tracked_club":"FC Porto","review_status":"reviewed","match_key":"R2-Rio_Ave-FC_Porto"},
  {"season":"2026/27","competition":"Liga Portugal","round":2,"date":"2026-08-17","home_team":"Casa Pia","away_team":"SL Benfica","score":"0-7","referee":"João Pinheiro","var":"Rui Costa","tracked_club":"SL Benfica","review_status":"reviewed","match_key":"R2-Casa_Pia-SL_Benfica"},
  {"season":"2026/27","competition":"Liga Portugal","round":3,"date":"2026-08-22","home_team":"Sporting CP","away_team":"FC Alverca","score":"3-1","referee":"Fábio Veríssimo","var":"João Malheiro Pinto","tracked_club":"Sporting CP","review_status":"reviewed","match_key":"R3-Sporting_CP-FC_Alverca"},
  {"season":"2026/27","competition":"Liga Portugal","round":3,"date":"2026-08-23","home_team":"FC Porto","away_team":"FC Arouca","score":"2-0","referee":"João Pinheiro","var":"Manuel Mota","tracked_club":"FC Porto","review_status":"reviewed","match_key":"R3-FC_Porto-FC_Arouca"},
  {"season":"2026/27","competition":"Liga Portugal","round":3,"date":"2026-09-09","home_team":"Moreirense","away_team":"SL Benfica","score":null,"referee":null,"var":null,"tracked_club":"SL Benfica","review_status":"not_played","match_key":"R3-Moreirense-SL_Benfica"},
  {"season":"2026/27","competition":"Liga Portugal","round":4,"date":"2026-08-28","home_team":"Rio Ave","away_team":"Sporting CP","score":"0-4","referee":"Bruno Costa","var":"Rui Soares","tracked_club":"Sporting CP","review_status":"reviewed","match_key":"R4-Rio_Ave-Sporting_CP"},
  {"season":"2026/27","competition":"Liga Portugal","round":4,"date":"2026-08-29","home_team":"Académico de Viseu","away_team":"FC Porto","score":"0-3","referee":"Miguel Nogueira","var":"Pedro Ferreira","tracked_club":"FC Porto","review_status":"reviewed","match_key":"R4-Académico_de_Viseu-FC_Porto"},
  {"season":"2026/27","competition":"Liga Portugal","round":4,"date":"2026-08-31","home_team":"SL Benfica","away_team":"Estoril","score":"2-1","referee":"Hélder Carvalho","var":"Tiago Martins","tracked_club":"SL Benfica","review_status":"reviewed","match_key":"R4-SL_Benfica-Estoril"},
  {"season":"2026/27","competition":"Liga Portugal","round":5,"date":"2026-09-04","home_team":"FC Porto","away_team":"Moreirense","score":"2-1","referee":"António Nobre","var":"Bruno Esteves","tracked_club":"FC Porto","review_status":"reviewed","match_key":"R5-FC_Porto-Moreirense"},
  {"season":"2026/27","competition":"Liga Portugal","round":5,"date":"2026-09-05","home_team":"CS Marítimo","away_team":"SL Benfica","score":"0-3","referee":"Sérgio Guelho","var":"Manuel Oliveira","tracked_club":"SL Benfica","review_status":"awaiting_full_expert_review","match_key":"R5-CS_Marítimo-SL_Benfica","last_checked_at":"2026-09-06T01:43:00+01:00","review_notes":"Same-night coverage now includes Pedro Henriques on the 22' Prestianni no-penalty incident and a full VAR Bola Branca review by Tiago Rocha validating the major area/goal decisions. Under the strict S360 publication threshold the match remains pending until sufficient former-referee/official coverage closes the full review.","evidence_urls":["https://www.abola.pt/video/ha-penalti-sobre-prestianni-no-maritimo-benfica-a-analise-de-pedro-henriques-2026090521030039865","https://rr.pt/bola-branca/noticia/futebol-nacional/2026/09/05/nota-3-para-sergio-guelho-esteve-bem-nos-lances-capitais/484399/"]},
  {"season":"2026/27","competition":"Liga Portugal","round":5,"date":"2026-09-05","home_team":"Sporting CP","away_team":"CD Nacional","score":"2-0","referee":"João Pinheiro","var":"Pedro Ferreira","tracked_club":"Sporting CP","review_status":"awaiting_full_expert_review","match_key":"R5-Sporting_CP-CD_Nacional","last_checked_at":"2026-09-06T01:43:00+01:00","review_notes":"Match and video evidence are available, but no complete named former-referee review was found in the latest source sweep. Do not infer zero errors. Keep pending until expert/official coverage is available.","evidence_urls":["https://rr.vsports.pt/","https://rr.pt/bola-branca/noticia/sporting/2026/09/05/em-direto-veja-o-relato-do-sporting-nacional/484373/"]}
]
